I was born in the congo I walked to the fertile crescent and built The sphinx I designed a pyramid so tough that a star That only glows every one hundred years falls Into the center giving divine perfect light I am bad  I sat on the throne Drinking nectar with allah I got hot and sent an ice age to europe To cool my thirst My oldest daughter is nefertiti The tears from my birth pains Created the nile I am a beautiful woman  I gazed on the forest and burned Out the sahara desert With a packet of goat's meat And a change of clothes I crossed it in two hours I am a gazelle so swift So swift you can't catch me  For a birthday present when he was three I gave my son hannibal an elephant He gave me rome for mother's day My strength flows ever on  My son noah built new/ark and I stood proudly at the helm As we sailed on a soft summer day I turned myself into myself and was Jesus Men intone my loving name All praises All praises I am the one who would save  I sowed diamonds in my back yard My bowels deliver uranium The filings from my fingernails are Semi-precious jewels On a trip north I caught a cold and blew My nose giving oil to the arab world I am so hip even my errors are correct I sailed west to reach east and had to round off The earth as I went The hair from my head thinned and gold was laid Across three continents  I am so perfect so divine so ethereal so surreal I cannot be comprehended except by my permission  I mean... I... Can fly Like a bird in the sky...,Happy
"This is dedicated to the one I love  While I'm far away from you, my baby, I know it's hard for you, my baby, Because it's hard for me, my baby, And the darkest hour is just before dawn  Each night before you go to bed, my baby, Whisper a little prayer for me, my baby, And tell all the stars above, ""This is dedicated to the one I love""  Life can never be exactly like we want it to be But I can be satisfied just knowing you love me There's one thing I want you to do especially for me And it's something that everybody needs  Each night before you go to bed, my baby, Whisper a little prayer for me, my baby, And tell all the stars above, ""This is dedicated to the one I love""  This is dedicated to the one I love (Repeat and fade out)",Happy
When I grow up I want to be a forester Run through the moss on high heels That's what I'll do Throwing out a boomerang Waiting for it to come back to me  When I grow up I want to live near the sea Crab claws and bottles of rum That's what I'll have Staring at a seashell Waiting for it to embrace me  I put my soul into what I do Last night I drew a funny man With dog eyes and a hanging tongue It goes way back I've never liked that sad look From someone who wants to be loved by you  I'm very good with plants When my friends are away They let me keep the soil moist On the seventh day I rest For a minute or two Then back on my feet to call for you  You've got cucumbers on your eyes Too much time spent on nothing Waiting for a moment to arise The face in the ceiling And arms too long I'm waiting for him to catch me,Sad
"Let me go home whiskey, let me walk out that door Let me go home whiskey, let me walk out that door I got orders from my baby Not to come home juiced no more I stop by a fence to visit with a friend of mine I just dropped in for a minute But I over stayed my time  Let me go home whiskey, let me walk out that door Let me go home whiskey, let me walk out that door I got orders Don't you come home drunk no more  Why oh why does whiskey Make me lose my head Got me sitting at a bar When I should be home in bed  Let me go home whiskey, let me walk out that door Let me go home whiskey, let me walk out that door I got orders from my baby Not to come home drunk no more  Yeah whiskey every morning Whiskey every night As long as I got my whiskey Everything's alright  Let me go home whiskey, let me walk out that door Let me go home whiskey, let me walk out that door I got orders from my baby Don't you come home drunk no more",Sad
"Oh, come on, come on, come on, come on!  Didn't I make you feel like you were the only man  yeah! An' didn't I give you nearly everything that a woman possibly can? Honey, you know I did! And each time I tell myself that I, well I think I've had enough, But I'm gonna show you, baby, that a woman can be tough.  I want you to come on, come on, come on, come on and take it, Take it! Take another little piece of my heart now, baby! Oh, oh, break it! Break another little bit of my heart now, darling, yeah, yeah, yeah. Oh, oh, have a! Have another little piece of my heart now, baby, You know you got it if it makes you feel good, Oh, yes indeed.  You're out on the streets looking good, And baby deep down in your heart I guess you know that it ain't right, Never, never, never, never, never, never hear me when I cry at night, Babe, and I cry all the time! But each time I tell myself that I, well I can't stand the pain, But when you hold me in your arms, i'll sing it once again.  I'll say come on, come on, come on, come on and take it! Take it! Take another little piece of my heart now, baby. Oh, oh, break it! Break another little bit of my heart now, darling, yeah, Oh, oh, have a! Have another little piece of my heart now, baby, You know you got it, child, if it makes you feel good.  I need you to come on, come on, come on, come on and take it, Take it! Take another little piece of my heart now, baby! Oh, oh, break it! Break another little bit of my heart, now darling, yeah, c'mon now. Oh, oh, have a Have another little piece of my heart now, baby. You know you got it  whoahhhhh!!  Take it! Take it! Take another little piece of my heart now, baby, Oh, oh, break it! Break another little bit of my heart, now darling, yeah, yeah, yeah, yeah, Oh, oh, have a Have another little piece of my heart now, baby, hey, You know you got it, child, if it makes you feel good.",Happy
"Kingston, hey, face drop, oh, Kingston, I see your face drop, drop, drop  You touch my heart, disappear I never knew how much it hurt here (Made me feel like) My girl, girl, girl, girl, girl  First came trust, then came love But this was none of the above, I'm aware (Made me feel like) My girl, girl, girl, girl, girl, hey  But you're the one who said That I'd be lost without you (No, no, no, no) You had your fun, couldn't write This one without you, baby (No, no, no)  And now I see your face drop I told you not to leave me alone And now that I got my own I see your face drop I told you not to count me out, hey  'Cause you always try to fill me with doubt Sayin' that I look better if I was thinner Don't you know you shoulda love me for my inner When I left you, yo, I came out a winner  Did all I can, I understand That every girl do for their man (Made me feel like) My girl, girl, girl, girl, girl  I cut it short, 'cause you got caught You're not the girl you used to be no more (Made me feel like) My girl, girl, girl, girl, girl  But you're the one who said That I'd be lost without you (No, no, no, no) You had your fun, couldn't write This one without you, baby (No, no, no)  And now I see your face drop I told you not to leave me alone And now that I got my own I see your face drop I told you not to count me out  'Cause you always try to fill me with doubt Sayin' that I look better if I was thinner Don't you know you shoulda love me for my inner When I left you, yo, I came out a winner  Tellin' me come on back, what will I do from that? I would still, still be yours if you knew how to act But you underestimate a dude like me And I love it when I see your  Face drop, I told you not to leave me alone And now that I got my own I see your face drop I told you not to count me out 'Cause you always try to fill me with doubt  Sayin' that I look better if I was thinner Don't you know you shoulda love me for my inner When I left you, yo, I came out a winner  And now I see your face drop I told you not to leave me alone And now that I got my own I see your face drop I told you not to count me out (Thank you beautiful) 'Cause you always try to fill me with doubt  Sayin' that I look better if I was thinner (Thank you beautiful) Don't you know you shoulda love me for my inner When I left you, yo, I came out a winner",Happy
"I always knew, that I'd like this place You don't have to look too far, to find a friendly face I feel alive when I'm walkin' on the street I feel the heart of the city poundin' underneath my feet  [CHORUS] Yeahhhhh let the world keep spinnin round 'n' round This is where it's goin' down, down, down That's why I, love this town That's why I, keep co-min' round  Say hey (say hey) say yeah (say yeah) You make me feel at home some how, right, now That's why I, love this town  I've got some good friends here, I might have broke a heart or two It's gettin' loud over there, they boys must have had a few And hey the cop on the corner, he knows everybody's name And a kid with a dream singin' for some spare loose change  [CHORUS] Yeahhhhh let the world keep spinnin round 'n' round This is where it's goin' down, down, down That's why I, love this town That's why I, keep co-min' round  Say hey (say hey) say yeah (say yeah) You make me feel at home some how, right, now  That's why I, love this town  [GUITAR SOLO]  There's shoutin' from the rooftops Dancin' on the bars Hangin' out the window Drivin' in their famous cars You want it? You got it You ready? I'm on it Come on now, here we go agaiiinnnnnn....  That's why I, love this town That's why I, love this town  No matter where you're from, tonight you're from right here This is where it all goes down, down, down That's why I, love this town  [REPEAT x3] Say hey (say hey) say yeah (say yeah) I love this town [END REPEAT]  Say hey (say hey) say yeah (say yeah) I lo-ove this town  [GUITAR SOLO - END OF SONG]",Happy
"I was so downhearted, baby, till I met with you. Oh, you took me, took me, out of the blue. You shook me, shook me, out of the blue.  Out of the blue into your arms,  Oh, I came out of the blue, leavin' the pain behind. Just as if the rain was fallin', you came into view. Oh, you took me, took me, out of the blue. You shook me, shook me, out of the blue.  Out of the blue into a love,  So real, yeah! Out of the blue, how very strange it feels. Everything was so unproven, till you pulled me through. Oh, you took me, took me, out of the blue. You shook me, shook me, out of the blue.  [Doo doo-doo doo doo, doo-doo doo doo] You passed my way, I asked your name. And since that day I'm not the same. I fell so hard for you, for every little part of you.  Oh, out of the blue into your arms,  Oh, I came out of the blue into your love just in time. Everything was so unproven, till you pulled me through. Oh, you took me, took me, out of the blue You shook me, shook me, out of the blue.  Out of the blue, baby, you took me out of the blue Out of the blue, baby, you shook me out of the blue Repeat until fade out",Happy
"Intimate scenes fresh from my dreams Over a triple-X movie screen I couldn't care less about being seen Higher self-esteem if you on me I say baby, do you think? Sugar so sweet should rot my teeth But instead it just rottens me  Spoiled crazy I said public display of affection (Gotta make 'em) Pointing in our direction (Watch 'em, watch 'em) Public display of affection Makes them wish they had it this way  [Chorus:] We'd be at the club, the restaurant, the grocery store or the movies Kissin and touchin with my hands all over your booty Wherever it is, we is, I love it truly Your pda-A-A (I want your pda) Your pda-A-A (I want your pda) Your pda-A-A (I want your pda)  Remember at the beach we brought the sheets We were harassed by police Good thing we didn't go too deep Everywhere we be the passion in me just screams I just need you in my reach Baby your suspense can be intense It's got me convinced (oh yeah) You're the fingers to my instrument  Public display of affection (Gotta make 'em) Pointing in our direction (Watch 'em, watch 'em) Public display of affection Makes them wish they had it this way  [Chorus:] We'd be at the club, the restaurant, the grocery store or the movies Kissin and touchin with my hands all over your booty Wherever it is, we is, I love it truly Your pda-A-A (I want your pda) Your pda-A-A (I want your pda) Your pda-A-A (I want your pda)  Your pda-A-A Your pda-A-A (I want your pda)  From the lobby to the patio And we so compatible From the Starbucks to the Navajo And we so compatible  [Chorus:] We'd be at the club, the restaurant, the grocery store or the movies Kissin and touchin with my hands all over your booty Wherever it is, we is, I love it truly Your pda-A-A (I want your pda) Your pda-A-A (I want your pda) Your pda-A-A (I want your pda)  Your pda-A-A Your pda-A-A (I want your pda)  I wanna run (I want your pda) All over your body (I want your pda) I wanna run (I want your pda) All over your body (I want your pda)  I want your pda Public display of affection Hmm, I want your pda",Happy
I can't exist anymore Till I destroy you I hate everyone Don't know what to do Ingesting flesh and bone Makes me a cannibal Or am I criminal? I feel so horrible  Horrible Now everything's horrible Horrible  Sucking on colorforms Becoming see through Still hating everyone As I detest you I do not feel wrong This makes me durable Or am I criminal I'm so damn horrible  Horrible Now everything's horrible Horrible  Fade into yesterday Searching for my youth Trying to digest it all Searching for the truth Self centered devil spawn This makes me durable Or am I criminal I'm fucking horrible  Horrible Now everything's horrible Horrible  Horrible Now everything's horrible Horrible Horrible,Happy
"I got something to say little girl You might not like my style But we've been hanging around this town Just a little too long a while  You say you're gonna get your act together Gonna take it out on the road But if I don't get outta here pretty soon My head's going to explode  Sure I like country music I like mandolins But right now I need a telecaster Through a vibro-lux turned up to ten  Chorus: Lets go to memphis in the meantime baby Memphis in the meantime girl  I need a little shot of that rhythm baby Mixed up with these country blues I wanna trade in these ol country boots For some fine italian shoes  Forget the mousse and the hairspray sugar We don't need none of that Just a little dab'll do ya girl Underneath a pork pie hat  Until hell freezes over Maybe you can wait that long But I don't think ronnie milsap's gonna ever Record this song  Chorus twice  Bridge: Maybe there's nothin' happenin' there Maybe there's somethin' in the air Before our upper lips get stiff Maybe we need us a big ol whiff  If we could just get off-a that beat little girl Maybe we could find the groove At least we can get a decent meal Down at the rendez-vous  'cause one more heartfelt steel guitar chord Girl, it's gonna do me in I need to hear some trumpet and saxophone You know sound as sweet as sin  And after we get good and greasy Baby we can come back home Put the cowhorns back on the cadillac And change the message on the cord-a-phone  But...  Chorus",Happy
I ain't goin' I'm gone Up up up and away And I'm on A higher plane With a brain With a flame Feel the fire Desire the same Knowledge and wisdom And understanding Possessed by gods Transferred to man in A script of a book A scripture that looks Like a biblical writing Inviting a hook Of a song sing along with a strong Subliminal Message divesting all men from Criminal Acts of the devil Revealed and reveled Designed to recline the mind to lower level With no spiritual level Read the holy koran Or the bible Because it's liable To be a revival For the weak who seek power it'll bring Infallible power Knowledge is king Knowledge Who wants some Come get it A battle is a test of wits And I'm witted Hard beats a torch And I lit it Stop the music Alright hit it Now that it feels good I'm heating up I feed off knowledge And can't get enough Knowledge is infinite Suckers ain't into it Ignorance is bliss And they're kin to it Party and dance And don't ever glance At a book or look For their mind to advance Caught in a rut Chasing butt Trying to get a dollar Or trying to get a nut Evil feeds Off a source of apathy Weak in the mind And of course you have to be Less than a man More like a thing No knowledge you're nothin' Knowledge is king Knowledge My rhymes make A meak mind anorexic You can't hang without slang So eject it I've selected Rhymes for records To affect the effect Of the rhyme that left Hangin' like a pound That came down But you're hangin' the brain So your brain's hell-bound Lost and found By the serpent's sound What you don't know Can't hurt that's profound Or absurd A better word An ingnorant fool Is a real cool nerd Pockets are fat With an empty head Got a little fame and a name And you're brain dead You count dollars So ya think ya in What good is knowing how to count If you don't know when And history today And it will equal the future Repetitive mistakes Cause the brain ain't acute ya Need knowledge To understand The concept of sacrifice But man don't understand So we have to fight War Killing people we never Saw before Most don't eden know What they're killin' for Following rulers Instead of the prophets The wicked can rule ya But the knowledge can stop it Souls can't be controlled It's a spiritual thing But you got the knowledge Knowledge is king Knowledge My knowledge comes From a spiritual force Stonger than any Earthly source Propaganda Hype or slander I won't believe the hype I understand the Media dictates The mind and rotates The way you think And syncopates slow pace Brains Can't maintain Acertain Insipid inane crass rain Insane lame Traditions All praise fame Positions Want to be a star Drive a big car Live bourgeios Ane won't know who you are Lost in the source And praising the dollar Whether your faith is Christ or allah The knowledge of god Will teach one thing The dollar is moot Knowledge is king,Happy
"Take my hand and walk with me a while Cause it seems your smile has left you And don't give in, when you fall apart And your broken heart has failed you I'll set a light up On a hilltop To show you my love For this world to see  You can borrow mine When your hope is gone Borrow mine When you can't go on 'Cause the world will not defeat you When we're side by side When your faith is hard to find You can borrow mine  Take my love when all that you can see Is the raging sea all around us And don't give up 'cause I'm not letting go And the God we know will not fail us We'll lay it all down As we call out Sweet Savior Help our unbelief  You can borrow mine When your hope is gone Borrow mine When you can't go on 'Cause the world will not defeat you When we're side by side When your faith is hard to find You can borrow mine  When you are weak Unable to speak You are not alone The God who has saved us Will never forsake us He's coming to take us Take us to our home  You can borrow mine When your hope is gone Borrow mine When you can't go on 'Cause the world will not defeat you When we're side by side When your faith is hard to find When your faith is hard to find You can borrow mine  Take my hand Take my love Don't give in Don't give up",Happy
"Sometimes I feel I can't make it In this world on my own So hard to see my direction But you gave me something to help me be strong  [Chorus:]  You gave me joy Yes you did, yes you did, yes you did You are my peace of mind oh ou oh You are my life Yes you are, yes you are yes you are And now for you Lord I lift my life oh Lord  At last my horizons are sunny My pain has been erased A new outlook a brighter day Since you smiled down on my spirit All my burdens washed away yeah I'm born again Blessed and safe  [Chorus:]  With every heartfelt melody And every song of praise I sing to you Somethin stirs inside of me, It's the love you have for me That is why I dedicate my life To you....  [Chorus:]",Happy
Buddy you're a boy make a big noise Playin' in the street gonna be a big man some day You got mud on yo' face You big disgrace Kickin' your can all over the place Sing it!  We will we will rock you We will we will rock you  Buddy you're a young man hard man Shoutin' in the street gonna take on the world some day You got blood on yo' face A big disgrace Wavin' your banner all over the place  We will we will rock you Sing it! We will we will rock you  Buddy you're an old man poor man Pleadin' with your eyes gonna make you some peace some Day You got mud on yo' face Big disgrace Somebody better put you back into your place  We will we will rock you Sing it We will we will rock you Come on! We will we will rock you Everybody We will we will rock you Hmm... [Guitar riff],Happy
"(P: PMD, E: Erick Sermon, B: Both)  P: Good morning Mr. Bozack, time to wake up the nuts (For what) to hit the shower, so I can wash the butt E: Damn (Last night was crazy) word life, I had a blast P: It was ass for days, nuts had a full tank of gas E: Golly, G, word P, tits and VD P: Pussy kicking louder than my Alpine Benzi, box E: Yes, I fresh, sweet like gumdrops Pay me like Oprah and no one to cockblock P: Slow down big fella (why) I think you're gassing me E: P, get off my big dick, chill, stop harrassing me P: Your dick, you mean my dick and don't forget Now let me scrub that head because it smells like fish B: Mr. Bozack (repeat 2X)  E: That's your fault, black (explain) no jim hat You got in some fly shit and stuck me in bear back Smarty, what happened over there at the party Was it Vodka and smeared on a bit of Bacardi P: No dick (don't call me that) sorry Mr. Bozack But you didn't help, talking bout (where the hoes at) E: I was hard (how hard) hard enuff to buck (Shit, you didn't rush the pussy) see, I stuffed her like a duck P: Mr. Bozack (what) you went out like a sucker E: Not me, G, P, 'cause you the one who bucked her P: Hachoo (God bless you) damn, here's a tissue E: Yo, P I'm feeling sick P: Relax, what can I get you, Tetracycline E: No a penicillin cap, it burns P: Yo, chill Mr. Bozack E: No, I can't believe that (cool Jack) screw that All you had to do was wear a jim hat P: I reached for one, but didn't quite make it She grabbed on your head piece, I couldn't quite take it Now lounge Mr. Bozack, stop cryin like a wuss Now bone up the nuts, g, 'cause yo, there's more puss E: Look, P, the B-O-Z is like Audi P: Audi like who E: Motherfuckin Kurt Gowdy  It's the jim... owwww, it burns Don't worry, G, I'll have ya hooked up on Friday We'll go get the shot real quick Everything will be copestetic Oh what the hell all, got to stab this hoe cake right?",Sad
"I'm feeling mean today Not lost, not blown away Just irritated and quite hated Self control breaks down Why's everything so tame? I Like my life insane I'm fabericating and debating Who I'm gonna kick around  Right now Can't find a way To get accross the hate When I see you  Right now I'm feeling strange inside I want to slash and beat you  Right now I rip apart the things inside That excite you  Right now I can't control myself I fucking hate you  I'm feeling cold today Not hurt just fucked away I'm devastated and frustrated God I feel so bound So why'd I feel the need? I think it's time to bleed I'm gonna cut myself And watch the blood hit the ground  Right now Can't find a way To get accross the hate When I see you  Right now I'm feeling strange inside I want to slash and beat you  Right now I rip apart the things inside That excite you  Right now I can't control myself I fucking hate you  You open your mouth again I swear I'm gonna break it You open your mouth again, Oh God I cannot take it  Shut up, shut up, shut up or I'll fuck you up Shut up, shut up, shut up or I'll fuck you up Shut up, shut up, shut up or I'll fuck you up! Shut up, shut up, shut up or I'll fuck you up! Shut up, shut up, shut up or I'll fuck you up! Shut up, shut up, shut up or I'll fuck you up!  Right now Can't find a way To get accross the hate When I see you  Right now I'm feeling strange inside I want to slash and beat you  Right now I rip apart the things inside That excite you  Right now I can't control myself I fucking hate you  I fucking hate you [x4] I fucking hate you (Shut up!) [x2]  Shut up!",Sad
"You hear me so clearly And see how I try You feel me, so heal me And tear me apart  And I won't tell a soul I won't tell at all And do they have to know About my goodnight girl  Caught up in your wishin' well You hopes inside it Take your love 'n' promises And make them last(you make them last)  You keep me so near you And see me so far And hold me and send me And deep in your heart  And I won't tell a soul I won't tell at all And I won't let them know About my goodnight girl  Caught up in your wishin' well You hopes inside it Take your love 'n' promises And make them last (you make them last)  Caught up in your wishin' well You hopes inside it Take your love 'n' promises And make them last (you make them last)  It doesn't matter how sad I made you Doesn't matter how hard I try  Just remember the same Old reason Reflected in your eyes You said you wanted me  Caught up in your wishin' well Your hopes inside it Take your love 'n' promises And make them last (you make them last)  Caught up in your wishin' well Your hopes inside it Take your love 'n' promises And make them last (you make them last)",Happy
