"Oh my love, oh my love I can't hear you my love Tell me where have you gone  Oh my love, oh my love I can't taste you my love Tell me what have I done  Plug it in, so I can digest you I will taste you  Far away, far away I can't feel you today I need healing my love  Appetite running fast Following my gut Turning up every rock  You're disappearing my love I need louder than this Please fill me up  Good tidings I bring To you and your sins I'll forgive  Come to me Plug it in, so I can digest you I will taste you (taste you) My appetite in that hole Tempt you with it now I will taste you (Ooh ooh)  Please shake me and tug, I need shaking my love Can't you be the one  I can't fake it my love I need filling come on I need it louder than bombs  Come to me Plug it in, so I can digest you I will taste you (taste you) My appetite in that hole Tempt you with it now I will taste you (taste you, taste you, taste you)  Feel that movement my love Pulling up from above Are you lis'ning love  My emptiness in a way Is tempting Guiding you from my gut  I will taste you I will taste you (I've got a big mouth) I've got a big mouth (I will taste you) I will taste you (I've got a big mouth) I've got a big mouth I will taste you I will taste you (I've got a big mouth) I will taste you  Oh my love, oh my love I can't hear you my love Tell me where have you gone  Far away, far away I can't feel you today I need healing my love  Oh my love, oh my love, oh my love (Oh my love, oh my love)",Happy
"In a rusted red Chevy with a heart full of glory She left that night A suitcase at the door open wide let the cold air come in And then she asked me for a light  Said she had some old business see an old friend Or maybe make a new start But the words of her reason they changed with the season And the truth burned in my heart  It blew me away and I thought I'd go crazy 'Cause I knew even then I was caught  I'm caught in the rain again I pray to the Heavens to defend me I'm caught in the rain Why's it seem like more rain that they send me?  So I listen to the wind for the answer Time hangs heavy on my face I run from the storm that's on it's way Until I find there is no place  No person, no thing I can run to, no shelter I can gain from the rain Yes I know this time it's too late, now  'Cause I'm caught in the rain again And I pray to the Heavens to defend me I'm caught in the rain Why's it seem like more rain that they send me? And they send me  And the rain comes down so silently And time stand's still like it's in front of me And the years turn to the rain And this silence kills me  So now in this one horse town bar I sing in the back room in the December night Here she comes through the doorway With a blustering wind that's too cold to forget  She looks like she knew me The heat shot through me, melted me down So we sat and talked about the old days Or any new things that we found  Talked about the days when we were so much younger and innocent We saw it plain, we were just caught in the rain  We're caught in the rain again I pray to the Heavens to defend me Caught in the rain Why's it seem like more rain that they send me?  I'm out here on my knees And my love knows I've been trying Still I'm caught in the rain on these old fool ideas I'm relying So I guess she gets me the rain again",Sad
"Fly, fly high my Black Eagle Let golden thread bind our eyes  May our minds and hearts blood unite  On your wings carry me over the abyss  Beyond The Reason and across the burning seas  Then, with your claw tear the earth to the halves  And usher me into the secrets of her bowels  Down to the light of the beginning and the end which shimmers  Circle! Round and round my Black Eagle Let our senses be touched by ultimate pleasure  May the passion of hunting become all - devouring Slash! Slash with your beak  Remove all gods from my way, and thoughts, and sorrows  And let me trespass the barriers of fear Scream! Let the whole cosmos tremble  May echoes become my the sweetest mantra  Spirit of Freedom! Eternal Wanderer! Joyfull Solitude!  Higher and higher towards the stars of Awareness  Let worlds of imagination and fact become one I'm you and you are me",Happy
Waiting for another line Cause you throw them at me all the time Gotta get away from all her lies And I gotta get away from mine  Tell me where to go When fate won't deliver Cause I can't forgive her When I let her know This pain I've been living Will her next collision be me  Brings situation down And her temper's always on the rise I'm living what I've seen before Well I won't take this anymore It's time to hold this to the light  Tell me where to go When fate won't deliver Cause I can't forgive her When I let her know This pain I've been living  Will her next collision be me  Cause her mental prison is not my decision So I'm cutting my losses this time I'm no longer living through her tunnel vision  Tell me where to go When fate won't deliver Cause I can't forgive her When I let her know This pain I've been living Will her next collision be me  Gotta get away from Gotta get away Gotta get away this time  Tell me where to go When fate won't deliver Cause I can't forgive her When I let her know This pain I've been living Will her next collision be me,Happy
On the park bench I slept on Raindrops are fallin' on the newspapers coverin' me I hear early mornin' motors And I know the world is wakin' for the dawn  But my mind's down a dark alley Somewhere where last night you loved me And in the early mornin' chill my arms remember still But I'm droppin' like a stone lonesome to the bone  The sun is roughly risin' on the roofs of Stagger town The time for sweat and poison out is just now comin' 'round The high time of last midnight is over with and gone Leavin' me to be lonesome to the bone  I walked away the wind blows And any way the wind goes will be good enough for me The streets are loud and crowded But I walk my weary way lost and alone  Your hot breath and your laughter Keep flashin' through my mind to warm me But the naked light of day soon makes it fade away And I'm droppin' like a stone lonesome to the bone  The sun is roughly risin' on the roofs of Stagger town The time for sweat and poison out is just now comin' 'round The high time of last midnight is over with and gone Leavin' me to be lonesome to the bone,Happy
"It's all the same thing Now that it ever was Except now you've strayed too far Need you to stop digging your hole And follow the path we light  Don't need an invitation to be reconciled 'cause these home fires are burning Stare into your empty eyes and wonder...  ""how could something so right turn out so wrong?"" You spent your time making excuse For the ways of life that you are choosing How could something so right turn out so wrong? Not sure exactly where I am  The more we organize We suck out this life that serves as the fuel behind You wanna take the passion in my veins And put it down in black &amp; white  You've got your foot directly on the gas I watch you burn out so fast Now I can see just what you've become  And how could something so right turn out so wrong? I don't have a backup plan This is all that I am And how could something so right turn out so wrong? Not sure exactly where I am  (one) one thousand (good) intentions (lost) translation (lost) forever (one) one thousand (good) intentions (lost) translation (lost) forever Lost  And how could something so right turn out so wrong? I don't have a backup plan This is all that I am And how could something so right turn out so wrong? Not sure exactly where I am Where I am",Sad
"The walls are thin, the voices echo through her silent room A door slams shut, the shouting follows soon Those deafening familiar screams Alcoholic haze, lipstick trace a place where lights are low While mother can't pretend she doesn't know Hearing all the retread lies Banning all the reasons why Bloody Mary, can't find her way home Bloody Mary, can't do what she's told Bloody Mary, always on hold Something's going on around here It's just not clear....",Sad
"Ellis Hall and Jud Friedman So many years, so confused Wondering where I'm goin' to Roads with no signs Dreams left behind Nothing made sense without you Now that you're here, I understand Now it's clear who I am It's like coming home Achild, but full grown The whole world familiar yet new Chorus: I have been searching for such a long long time I have been missing something in my life Lord I was lost, 'til you pulled me through I found myself, I found myself in you Never belonged, or wanted to But now I belong forever to you You've made me see, all I can be You put your faith in me Repeat Chorus Shown me You know me Better than I Have been searching for such a long long time I have been missing something in my life Lord I was lost, 'til you pulled me through yeah I found myself I found myself in you I found myself in you I found myself in you",Happy
"White light. Doo doo too doo doo too. White light. Doo doo too doo doo too. White light. Doo doo too doo doo too. Echo, Echo, Echo white light!  White light. Doo doo too doo doo too. White light. Doo doo too doo doo too. White light. Doo doo too doo doo too. Echo, Echo, Echo, white light!  White light. Doo doo too doo doo too. White light. Doo doo too doo doo too. White light. Doo doo too doo doo too. Echo Echo Echo white light!",Happy
"S. colvin - j. leventhal  The streets of my town are not What they were They are haloed in anger, bitter And hurt And it's not so you'd notice but It's a sinister thing Like the wheels of ambition at The christening   So I went out walking on the Streets of the dead With a chip on my shoulder And a voice in my head It said you have been brought here Though you don't know what for   Well the mystery train is coming Right to your door   And I hear you calling, you Don't have to call so loud I see you falling and you don't Have to walk so proud You can run all night but we Can take you where You can cry like an angel   There were high school night dances When we played stump the band We were raising each other In a strange land There were hard pills to swallow But we drank 'em all down Oh the nights were too short then And now they're a little too long   I hear you calling and you Don't have to call so loud I see you falling and you don't Have to walk so proud You can run all night but we Can take you where You can shout out in anger You can laugh like a fool You can cry like an angel   So look homeward baby Keep your eyes on the sky They will never forgive you So don't ask them to try This is your party, I know It's not your ideal May we all find salvation In professions that heal   I hear you calling, you Don't have to call so loud I see you falling and you don't Have to walk so proud You can run all night but we Can take you where You can shout out an answer You can laugh like a fool   You can call up to heaven We'll be listening to you You can sing hallelujah You can fly like a bird You can cry like angel When there are no words",Happy
"Pick up the fragments and piece them together Tell me do you like what you've found? Are your thoughts like the earth spinning round? Existence is pure pantomime Why is life such a puzzle sometimes?  Trapped in a world I no longer feel part of Each day is a thorn in my side Though I've carried my cross - worn my heart on my sleeve Still deep inside something has died. If men have a sell-by-date I've just reached mine Now we've come to the end of the line. Why is life such a puzzle sometimes?  Well I just can't believe that it's happened again Always knew that it would - just a matter of when A lie was the last straw on this camels back And just like Lot's wife I could never look back. So maybe the reason I act so estranged Is you still dream of him, it's you that has changed.  No method to madness - no reason to rhyme Now we've come to the end of the line. Why is life such a puzzle sometimes?  Well I just can't believe that it's happened again Always knew that it would - just a matter of when A lie was the last straw on this camels back And just like Lot's wife I could never look back. So maybe the reason I act so estranged Is you still dream of him, it's you that has changed.  If men have a sell-by-date I've just reached mine Now we've come to the end of the line. Why is life such a puzzle sometimes?",Happy
"Mai falls like a star at a feather's pace into my heart With the dragon's weight And police make siren sounds wind down my street to take The breath from my lungs sweet I tried so hard to cover up this taste, It's like a sinner's constant fall from grace I changed my name, my voice, my face I killed my name, my voice, my pace And antibiotics on the sixteenth day of Mai I lost my will Forms a new fate this reoccurring theme has killed my faith It's drowning me in stereo and waste And all my bridges burn together And now my city lights are turning down this thin white line I follow blind, you tried to help me but I have to drown Acts of faith the makeup on my sinner's face I run so hard at absent pace to cover up this bitter taste of waste",Happy
When I grow up I want to be a forester Run through the moss on high heels That's what I'll do Throwing out a boomerang Waiting for it to come back to me  When I grow up I want to live near the sea Crab claws and bottles of rum That's what I'll have Staring at a seashell Waiting for it to embrace me  I put my soul into what I do Last night I drew a funny man With dog eyes and a hanging tongue It goes way back I've never liked that sad look From someone who wants to be loved by you  I'm very good with plants When my friends are away They let me keep the soil moist On the seventh day I rest For a minute or two Then back on my feet to call for you  You've got cucumbers on your eyes Too much time spent on nothing Waiting for a moment to arise The face in the ceiling And arms too long I'm waiting for him to catch me,Sad
"Great, great broad, miss janis joplin, please!  If there's something you need, Hon that you've never, ever, ever had. And I know you've never had it. Oh, honey, don't you just sit there crying, Don't just sit there feeling bad. No, no, no. You'd better get up, Now, don't you understand? And raise you hand. I said, raise, raise your hand.  You know I'm standing about, yes I am. And I want to give you all my love. Oh, won't you open up, I said, open up your heart. Please let me try.  You'd better be good. Don't ya understand? Raise your hand. I said, I wanna see it up in the air, babe, Right here, right now, yeah!  Whoaaaah, yeah!  If you ever, ever need me, Honey why won't you come and tell me so now? Baby if you want to give all of my loving, I want to let it go. You'd better be good, don't you understand, I said raise it, raise it, raise it, raise it, Raise.  Honey honey what it was Honey honey what it was Honey honey what it was Whoaaaah Whoaaaah Whoaaaah Whoaaaah Alright Alright Raise your hand 'cause I want you to come along, Raise your hand 'cause I want you to move Honey groove Come along, baby Come, said come, come on, Come, come, come on, Come, come, come on, Come, come, come on, Hey now now now now Hey now now now now Raise your hand Raise your hand Raise your hand, yeah, Raise your hand, yeah, Raise your hand Raise your hand Raise your hand Raise your hand Raise your hand, yeah, Raise your hand, yeah, Raise your hand, yeah, Raise your hand, yeah yeah yeah, You gotta, hey hey, You gotta, hey hey, Raise your hand Raise your hand Raise your hand Raise your hand, alright! Awww! Yeah!!  Alright, thank you.",Happy
Selwyn Brown We've had our differences Now it's time to patch things up We've been through trying times Though the going got so rough Give thanks and praise that we have made it Making a new start I know a place for you baby Deep inside my heart  We're on that magic road We need each other so Never to let go It's love for ever more  Chorus  Our joy is living in a house of love This kind of love you can't get enough Our joy is living in a house of love This kind of love you can't get enough  So much wasted time On who that it was to blame And now that we've both realised Before it was too late This time around yes we can make it I feel it in the air I'm coming home to a special lady She'll be waiting  Chorus  House of Love (Repeat X 5)  This adoration yes is safe and sound my friend Compassion built on solid ground Oh it's joy for both of us to reconcile Oh yeah under one roof together side by side  We're on that magic road We need each other so Never to let go It's love for ever more  Chorus  This a house of love Can't get enough (Repeat X 2)  Our joy's living in a Living in a living in a,Happy
"Sometimes it's hard for me to understand Why we pull away from each other so easily Even though were all walkin the same road Yet we build dividing walls between our Brothers and ourselves, but I, I don't care What label you may wear, if you believe in Jesus You belong with me, the bond we share And all I care to see it will change the world forever If you will join with me, join and sing, sing... Chorus: Youre my brother you're my sister So take me by the hand Together we will work until He comes There's no foe that can defeat us If were walkin side by side As long as there is Love We will stand The day will come that we will be as one And with a mighty voice together We will all proclaim that Jesus, Jesus is King It will echo through the earth It will shake the nations And the world will see And they will see Chorus Take me by the hand Join with me Join let us sing Chorus",Happy
"I don't know now Its not the time, to talk about it Are you calling out this time? You'll see tonight, Please leave on the light  Are we done this time? Am I this all right? You let me down I know right now I've tried before to find a way  I know, I'm home When I walk in and see your face But now, you're gone, And my life seems so out of place  Why did I hide from you From all the things you do How can I last tomorrow When I can't even go today?  Turned inside out, You asked me why do I feel this way So what now? What's wrong? I know I feel the same Even I know can't you see I know why you're not here with me  I know, I'm home When I walk in and see your face But now your gone and my life Seems so out of place  Why did I hide from you From all the things you do How can I last tomorrow When I can't even go today Today, I knew when I said goodbye",Happy
"Reuben James In my song you'll live again And the phrases that I rhyme Are just the footsteps out of time From the time when I knew you Reuben James  Reuben James, all the folks around Madison County Cussed your name You're just a no-account, sharecropping colored man Who'd steal anything he can And everybody laid the blame on Reuben James  Chorus: Reuben James, for you still walk the furrowed fields of my mind Faded shirt, your weathered brow Your caloused hands upon the plow I loved you then and I love you now, Reuben James  Flora Grey, the gossip of Madison County died with child And although your skin was black You were the one that didn't turn your back On the hungry white child with no name Reuben James  Reuben James, with your mind on my soul And a Bible in your right hand You said turn the other cheek For there's a better world awaiting for the meek In my mind these words remain from Reuben James  (Music goes up a half step in the upcoming last verse) Reuben James one dark cloudy day they brought you from the field Until your lonely pinebox came Or Unto your lonely pinebox came Just a preacher and me in the rain Just to sing one last refrain for Reuben James",Happy
"You say you want me to say ""I'm sorry."" But I don't have to and I don't want to say it 'Cause I'm not sorry  I play the game and I can't really say that I like it Can't really say that I hate it Can't really say that I paid attention  When grey skies turn blue I'll come back for you My mind can't change my heart there's nothing I can do  When grey skies turn blue When dreams do come true Will you be the way that I remember you  You say that life with me is driving you crazy But I don't see it and I don't want see So I, I must be crazy  I didn't mean a thing when I said ""Nothing is fleeting."" Or worth repeating (worth repeating) Or worth repeating (worth repeating)  When grey skies turn blue I'll come back for you My mind can't change my heart there's nothing I can do  When grey skies turn blue When dreams do come true Will you be the way that I remember you  The cold wind on my face Is the only thing I felt In such a long time In such a long time It's been a long time Yeah, yeah  Yeah  When grey skies turn blue I'll come back for you My mind can't change my heart there's nothing I can do  When grey skies turn blue When dreams do come true Will you be the way that I remember you  Will you be the way that I remember you",Happy
Verse  Well When I want to rock steady (yeah)  I know I got to get ready  Close my eyes and I let myself go  Listen to oh baby let the music flow (yeah)  Chorus  Turn on your light  And stay with me a while  And ease your worried mind  Turn on light (now babe)  And stay with me a while  And rock steady  Verse  When my love gets a little bit too heave (Rock steady)  She's mine and I got to get ready (Yeah)  Close my eyes and I let myself go (Rock steady)  I listen to and let the music flow  Chorus  Guitar solo  Chorus  Chorus,Happy
"Where is the face I long to see Pictures of her in my mind They say that she will soon return  I know she'll be here any day now Just breezing into the room Her sweet perfume can send my senses  Dreaming of April Praying for her to arrive in all her finery I'm dreaming of April Maybe she'll linger this time Turning to smile at me These clouds of grey march in endless procession I'm waking every day Dreaming of April  I never know how blue the sky Until the dark days came These wistful words keep whispering  How much I used to take for granted The beauty of her eyes Till mine grew dim with winter, now I'm  Dreaming of April Praying for her to arrive in all her finery I'm dreaming of April Maybe she'll linger this time Turning to smile at me When these days of grey march in endless procession I'm waiting for a change And dreaming of April",Happy
